ID,title,actual_duration,status,study_type,arm_group_type,intervention_type,interventional_type_model,phase,fda_regulated_drug,fda_regulated_device,enrollment_count
2016-6346,Comparison of Healthy Diets on Breast Cancer Markers,795 days,Completed,Interventional,"Active Comparator, Active Comparator","Behavioral, Behavioral",Parallel Assignment,Not Applicable,No,No,11
N19TON,Immune Induction Strategies to Improve Response to Immune Checkpoint Blockade in Triple Negative Breast Cancer (TNBC) Patients,2489 days,Recruiting,Interventional,"Experimental, Experimental, Experimental","Drug, Drug, Drug",Parallel Assignment,Phase 2,No,No,52
Soh-Med-23-02-16,Efficacy of Neoadjuvant Endocrine Therapy Compared to Chemotherapy in Breast Cancer Patients,853 days,Not yet recruiting,Interventional,"Active Comparator, Active Comparator","Drug, Drug",Parallel Assignment,Phase 1,No,No,100
SIMR_onc19_IIS_DAndre_Ashwaga,Ashwagandha for Cognitive Dysfunction,1035 days,Unknown status,Interventional,"Experimental, Placebo Comparator","Drug, Drug",Crossover Assignment,Phase 2,Yes,No,80
PROICM 2018-02 SKY,Feasibility Study: Yoga Educational Project,333 days,Completed,Interventional,Experimental,Behavioral,Single Group Assignment,Not Applicable,No,No,24
GRASPA-TNBC-2018-02,Study of Eryaspase in Combination With Chemotherapy Versus Chemotherapy Alone for the Treatment of TNBC (TRYbeCA-2),1022 days,Terminated,Interventional,"Experimental, Active Comparator","Drug, Drug, Drug",Parallel Assignment,"Phase 2, Phase 3",No,No,27
NCI-2016-01293,Retinoid 9cUAB30 in Producing a Biologic Effect in Patients With Early Stage Breast Cancer,1905 days,"Active, not recruiting",Interventional,Experimental,"Procedure, Drug, Procedure",Single Group Assignment,Phase 1,Yes,No,39
BOOG 2021-01 SEQUEL-Breast,SEQUence of Endocrine Therapy in Advanced Luminal Breast Cancer (SEQUEL-Breast),2099 days,Recruiting,Interventional,Experimental,"Drug, Drug",Single Group Assignment,Phase 2,No,No,130
2020-1138,A Study on the Effectiveness of WeChat-based Online Education to Reduce Perioperative Anxiety in Breast Cancer Patients,423 days,Completed,Interventional,"Experimental, Placebo Comparator","Behavioral, Behavioral",Parallel Assignment,Not Applicable,No,No,392
432-17,Facilitating Oncology Patient-Clinician Communication Via E-health Innovations,688 days,Completed,Interventional,Other,Behavioral,Single Group Assignment,Not Applicable,No,No,31
20170770,"Study of Romiplostim for Chemotherapy-induced Thrombocytopenia in Adult Subjects With Non-small Cell Lung Cancer (NSCLC), Ovarian Cancer, or Breast Cancer",2514 days,Recruiting,Interventional,"Experimental, Placebo Comparator","Drug, Drug",Parallel Assignment,Phase 3,Yes,No,162
YX2021-070(F1),Effect of Intravenous S-ketamine on Opioid Consumption,638 days,Recruiting,Interventional,"Placebo Comparator, Experimental, Experimental","Drug, Drug, Drug",Parallel Assignment,Not Applicable,No,No,825
LCI-BRE-MTN-NIR-001,LCI-BRE-MTN-NIR-001:Ph I Study of Niraparib in Combo With Standard Chemo in Metastatic Trip Neg Breast Cancer,1736 days,Withdrawn,Interventional,"Experimental, Experimental, Experimental, Experimental, Experimental, Experimental","Drug, Drug, Drug, Drug, Drug, Drug",Sequential Assignment,Phase 1,Yes,No,0
1B-16-11,Exercise Intervention in Targeting Adiposity and Inflammation With Movement to Improve Prognosis in Breast Cancer,2192 days,Withdrawn,Interventional,"Experimental, Experimental, Active Comparator","Behavioral, Behavioral, Behavioral, Other, Other, Other, Other",Parallel Assignment,Not Applicable,No,No,0
7119-001,A Study of Tucatinib (MK-7119) in Combination With Trastuzumab and Capecitabine in Participants With Previously Treated Locally Advanced Unresectable or Metastatic Human Epidermal Growth Factor Receptor 2 Positive (HER2+) Breast Carcinoma (MK-7119-001),2799 days,"Active, not recruiting",Interventional,Experimental,"Drug, Biological, Drug",Single Group Assignment,Phase 2,Yes,No,56
PRO2,Evaluation of the Medidux™ Digital Health Application in Patients With HER2-positive Breast Cancer During Chemotherapy in Combination With HER2-targeted Therapy or Antibody-drug Conjugate Therapy.,578 days,Recruiting,Interventional,"Experimental, No Intervention",Device,Parallel Assignment,Not Applicable,No,No,585
KTI-21-01,Efficacy and Safety Study of REM-001 Photodynamic Therapy for Treatment of Cutaneous Metastatic Breast Cancer (CMBC),549 days,Not yet recruiting,Interventional,Experimental,Combination Product,Single Group Assignment,Phase 2,Yes,Yes,15
CDX-ONC-101,"A Study of CodaLytic, an Intratumoral Oncolytic Virus, in Patients With Breast Cancer",746 days,Not yet recruiting,Interventional,"Experimental, Experimental, Experimental, Experimental",Biological,Sequential Assignment,Phase 1,Yes,No,24
ICL-2022-1,Personalized Preventive Support for Cognitive Impairment in Non-Metastatic Breast Cancer (EFACog),793 days,Not yet recruiting,Interventional,Experimental,Other,Single Group Assignment,Not Applicable,No,No,56
1070741-1,Subclinical Lymphedema Treatment Study,2801 days,"Active, not recruiting",Interventional,"Active Comparator, Experimental","Other, Other",Parallel Assignment,Not Applicable,No,No,267
MO42319,A Study of Trastuzumab Emtansine in Combination With Atezolizumab or Placebo as a Treatment for Participants With Human Epidermal Growth Factor 2 (HER2)-Positive and Programmed Death-ligand 1 (PD-L1)-Positive Locally Advanced (LABC) or Metastatic Breast Cancer (MBC),3129 days,"Active, not recruiting",Interventional,"Active Comparator, Experimental","Drug, Drug, Other",Parallel Assignment,Phase 3,Yes,No,96
2021-1031,"A Pilot Study to Assess the Clinical Utility of PYLARIFY PET-CT for Detecting Metastasis in Pancreatic Cancer, Hepatocellular Carcinoma and Breast Cancer",796 days,Recruiting,Interventional,Experimental,Drug,Single Group Assignment,Phase 1,No,No,36
MCC-19337,HER2 Directed Dendritic Cell Vaccine During Neoadjuvant Therapy of HER2+Breast Cancer,2248 days,Recruiting,Interventional,"Active Comparator, Active Comparator, Experimental","Biological, Drug, Procedure",Parallel Assignment,Early Phase 1,Yes,No,32
18175,"A Study of Imlunestrant, Investigators Choice of Endocrine Therapy, and Imlunestrant Plus Abemaciclib in Participants With ER+, HER2- Advanced Breast Cancer",2157 days,Recruiting,Interventional,"Experimental, Active Comparator, Experimental","Drug, Drug, Drug, Drug",Parallel Assignment,Phase 3,Yes,No,860
4090,Study Evaluating Flexitouch Plus With Connectivity on Compliance in 30 Patients With Breast Cancer-Related Lymphedema.,463 days,Completed,Interventional,"Experimental, Experimental",Device,Parallel Assignment,Not Applicable,No,Yes,29
2021332GD,Contrast-enhanced Ultrasonography Combined With Blue Dye as Dual-tracer for Sentinel Lymph Node Biopsy,791 days,Not yet recruiting,Interventional,Experimental,"Procedure, Procedure",Single Group Assignment,Not Applicable,No,No,350
18238,Abemaciclib (LY2835219) Plus Fulvestrant Compared to Placebo Plus Fulvestrant in Previously Treated Breast Cancer,1438 days,Recruiting,Interventional,"Experimental, Active Comparator","Drug, Drug, Drug",Parallel Assignment,Phase 3,Yes,No,350
21152,Comparing Supplemental Topical Agents for the Treatment of Acute Radiation Dermatitis in Patients With Breast Cancer,443 days,Recruiting,Interventional,"Experimental, Experimental","Drug, Other, Other, Other",Parallel Assignment,Phase 1,Yes,No,200
BLTN-Ig,Pharmacokinetic Study of Pyrotinib and Docetaxel in Combination With Trastuzumab in Patients With HER2 Metastatic Breast Cancer,1271 days,"Active, not recruiting",Interventional,Experimental,"Drug, Drug",Single Group Assignment,Phase 1,No,No,97
I 62218,Chemokine Modulation Therapy and Pembrolizumab in Treating Participants With Metastatic Triple-Negative Breast Cancer,1605 days,"Active, not recruiting",Interventional,Experimental,"Procedure, Procedure, Drug, Biological, Drug, Biological",Single Group Assignment,Early Phase 1,Yes,No,8
Pro00080769,Phase II Multicenter Study of Durvalumab and Olaparib in Platinum tReated Advanced Triple Negative Breast Cancer (DORA),1365 days,Completed,Interventional,"Experimental, Experimental","Drug, Drug",Parallel Assignment,Phase 2,Yes,No,45
E2019316,A Single Arm Study of Brain Metastasis in Patients With HER2-positive Breast Cancer,761 days,Unknown status,Interventional,Experimental,"Drug, Radiation",Single Group Assignment,Phase 4,No,No,43
22-364,Study of Aerobic Training for People Receiving Chemotherapy for Breast Cancer,1826 days,Recruiting,Interventional,"Experimental, Active Comparator","Behavioral, Behavioral",Parallel Assignment,Phase 2,No,No,140
ISK-N103,"Safety and Efficacy of IV Nerofe™ Followed by Doxorubicin, In Metastatic Ovarian Cancer and Triple Negative Breast Cancer",593 days,Withdrawn,Interventional,Experimental,Biological,Single Group Assignment,"Phase 1, Phase 2",No,No,0
NCI-2019-02752,Testing the Addition of Copanlisib to Usual Treatment (Fulvestrant and Abemaciclib) in Metastatic Breast Cancer,1472 days,Recruiting,Interventional,"Experimental, Experimental, Experimental, Active Comparator","Drug, Drug, Drug",Sequential Assignment,"Phase 1, Phase 2",Yes,No,204
STao-003,Combined Use of Apatinib Mesylate and Vinorelbine Versus Single Use of Vinorelbine in Triple-negative Breast Cancer,1463 days,Not yet recruiting,Interventional,"Active Comparator, Experimental","Drug, Drug",Parallel Assignment,Phase 2,No,No,184
OSU-17122,Exercise and Diet Counseling Program in Improving Quality of Life in Stage I-III Breast Cancer Survivors,1761 days,Recruiting,Interventional,Experimental,"Other, Other, Other, Other, Other, Other",Single Group Assignment,Not Applicable,No,No,30
SKB264-Ⅱ-07,SKB264 +/- KL-A167 in Recurrent or Metastatic Triple-negative Breast Cancer,731 days,Not yet recruiting,Interventional,"Experimental, Experimental, Experimental","Drug, Drug",Parallel Assignment,Phase 2,No,No,95
LonghuaH,Clinical Study on Auricular Points Sticking Plus Chinese Medication for Hot Flashes in Breast Cancer Women,331 days,Unknown status,Interventional,"Active Comparator, Sham Comparator",Other,Parallel Assignment,Not Applicable,No,No,92
OTT 18-01,Comparing a Single-Dose vs. Twice Yearly Zoledronate in Patients With Early Stage Breast Cancer (REaCT-ZOL),1857 days,"Active, not recruiting",Interventional,"Active Comparator, Active Comparator",Drug,Parallel Assignment,Phase 4,No,No,211
PTC-breastNAT,PTC Guiding Neoadjuvant Treatment in Breast Cancer,790 days,Not yet recruiting,Interventional,"Experimental, No Intervention",Diagnostic Test,Parallel Assignment,Phase 2,No,No,40
ZL-1302-002,A Study to Evaluate the Efficacy and Safety of Margetuximab Plus Chemotherapy in the Treatment of Chinese Patients With HER2+ MBC,597 days,Unknown status,Interventional,"Experimental, Active Comparator","Drug, Drug, Drug, Drug, Drug",Parallel Assignment,Phase 2,No,No,120
MCC-21-18633,Entertainment Media to Deliver Educational Messages About Mammography in Saudi Arabia,32 days,Completed,Interventional,"Experimental, Active Comparator, No Intervention","Behavioral, Behavioral",Parallel Assignment,Not Applicable,No,No,240
Fudan-P1-201701,PD-1(Programmed Death-1) Antibody +GP as First Line Treatment for Triple Negative Breast Cancer(TNBC) Patients,1325 days,"Active, not recruiting",Interventional,"Experimental, Experimental, Experimental, Experimental","Combination Product, Combination Product, Combination Product, Combination Product",Parallel Assignment,Phase 1,No,No,31
2018-0473,Effect of PACK Health Support Program on Patient Reported Outcomes in Patients With Breast Cancer,1673 days,Recruiting,Interventional,"Experimental, Active Comparator","Other, Other, Other, Other, Procedure",Parallel Assignment,Not Applicable,No,No,545
2019-0638,Exercise During Chemotherapy in Older Women With Stage I-III Breast Cancer,1123 days,Recruiting,Interventional,Experimental,"Procedure, Other, Other, Other, Other, Other, Other, Other",Single Group Assignment,Not Applicable,No,No,30
NCC1786,Clinical Study of Xinmailong Injection on Reducing Cardiovascular Toxicity in Adjuvant Chemotherapy in Breast Cancer,2251 days,Recruiting,Interventional,"Experimental, No Intervention",Drug,Parallel Assignment,Phase 2,No,No,60
ZG-2021-002,ZetaFuse™ Bone Graft in the Repair of Bone Defects From Metastatic Breast Cancer in the Spinal Vertebral Body,365 days,Recruiting,Interventional,Experimental,Device,Single Group Assignment,Not Applicable,No,No,10
NU 19B07,"SGT-53, Carboplatin, and Pembrolizumab for the Treatment of Metastatic Triple Negative Inflammatory Breast Cancer",0 days,Withdrawn,Interventional,Experimental,"Drug, Biological, Genetic",Single Group Assignment,Phase 1,Yes,No,0
LUT-RD-02-01,LUT014 for the Treatment of Radiation Induced Dermatitis in Breast Cancer Patients,531 days,Completed,Interventional,"Experimental, Placebo Comparator","Drug, Drug",Parallel Assignment,"Phase 1, Phase 2",Yes,No,28
MEDOPP445,Preventive stRategy for IMMU132-relatED AEs in TNBC - PRIMED,1041 days,Recruiting,Interventional,Experimental,"Drug, Drug, Drug",Single Group Assignment,Phase 2,No,No,50
OSU-18174,A QoL Intervention for Young African American Breast Cancer Survivors,425 days,Recruiting,Interventional,"Experimental, Active Comparator","Other, Other, Other, Other",Parallel Assignment,Not Applicable,No,No,30
ICR-CTSU/2017/10065,PHOENIX DDR/Anti-PD-L1 Trial: A Pre-surgical Window of Opportunity and Post-surgical Adjuvant Biomarker Study of DNA Damage Response Inhibition and/or Anti-PD-L1 Immunotherapy in Patients With Neoadjuvant Chemotherapy Resistant Residual Triple Negative Breast Cancer,2239 days,Recruiting,Interventional,"No Intervention, Experimental, Experimental, Experimental","Drug, Drug, Drug",Parallel Assignment,Phase 2,No,No,81
VICC BRE 18108,A 2-Week Ketogenic Diet in Combination With Letrozole to Modulate PI3K Signaling in ER+ Breast Cancer,2124 days,Recruiting,Interventional,"Experimental, Active Comparator","Dietary Supplement, Drug",Single Group Assignment,Early Phase 1,Yes,No,36
RIGAIN,RecurIndex Guided Avoidance of Regional Nodal Irradiation for Node Positive Breast Cancer,4151 days,Recruiting,Interventional,"Experimental, Active Comparator","Radiation, Radiation, Radiation",Parallel Assignment,Not Applicable,No,No,540
Survey_App,Anonymous Survey of Breast Cancer Patients Concerning Their Use of Medical Apps,334 days,Recruiting,Interventional,Other,Other,Single Group Assignment,Not Applicable,No,No,200
DR210090_SILENCE,Efficacy and Safety of Non Invasive Vagal Stimulation to Prevent Chemotherapy-induced Nausea,700 days,Not yet recruiting,Interventional,"Experimental, Sham Comparator","Device, Drug, Device",Parallel Assignment,Not Applicable,No,No,338
OSU-21035,Web-Based Symptom Monitoring and Self-Management Portal (YES) for Adolescent and Young Adult Breast Cancer Survivors,1525 days,Recruiting,Interventional,"Experimental, Active Comparator","Other, Other, Other",Parallel Assignment,Not Applicable,No,No,360
19-031,ADVANCE (A Pilot Trial),1461 days,"Active, not recruiting",Interventional,"Experimental, Experimental","Drug, Drug, Drug",Parallel Assignment,Phase 1,Yes,No,41
20-166,Sacituzumab Govitecan +/- Pembrolizumab in Metastatic TNBC,2446 days,Recruiting,Interventional,"Experimental, Experimental, Experimental","Drug, Drug",Parallel Assignment,Phase 2,Yes,No,110
INCMNSZ REF 1239,Autologous Hematopoietic Stem Cell Transplantation as Adjuvant Treatment for Triple Negative Breast Cancer Patients,1369 days,Unknown status,Interventional,Experimental,"Drug, Drug, Drug, Procedure, Drug",Single Group Assignment,Phase 2,No,No,20
OSU-20101,A Quality of Life Intervention (Y-AMBIENT) for Young African American With Stage I-III Breast Cancer,944 days,Recruiting,Interventional,"Experimental, Active Comparator","Other, Other, Other, Other",Parallel Assignment,Not Applicable,No,No,40
UW18063,Hybrid Molecular Imaging of ER in Breast Cancer Patients With DCIS,2189 days,Recruiting,Interventional,Experimental,"Drug, Drug",Single Group Assignment,Phase 2,Yes,No,12
N201912134,A Patient-centered Continuous and Interdisciplinary Shared Decision Making Approach for Breast Cancer Rehabilitation,365 days,Unknown status,Interventional,"Experimental, No Intervention",Other,Parallel Assignment,Not Applicable,No,No,264
IRST174.21,"Yoga on QOL Physiological Distress&Fatigue, on Patients Affected by Breast Cancer in Adjuvant Radiotherapy",976 days,Unknown status,Interventional,"Experimental, No Intervention",Behavioral,Parallel Assignment,Not Applicable,No,No,120
OSU-18201,Intensity Modulated Radiation Therapy or 3-Dimensional Conformal Radiation Therapy in Treating Patients With Lymph-Node Positive Breast Cancer,1817 days,"Active, not recruiting",Interventional,"Experimental, Experimental","Radiation, Radiation",Parallel Assignment,Not Applicable,No,Yes,61
H-1912-010-086,To Assess the Efficacy of the LYMPHA in the Prevention of Lymphedema Following Axillary Dissection for Breast Cancer,725 days,Unknown status,Interventional,"Experimental, No Intervention",Procedure,Parallel Assignment,Not Applicable,No,No,34
DAN-22220205,A Dose-escalation Study of the Safety and Pharmacology of DAN-222 in Subjects With Metastatic Breast Cancer,818 days,Recruiting,Interventional,"Experimental, Experimental, Experimental, Experimental, Experimental","Drug, Drug, Drug",Sequential Assignment,Phase 1,Yes,No,30
UPCC 21118,"HOPE: Olaparib, Palbociclib and Fulvestrant in Patients With BRCA Mutation-associated, HR+, HER2-metastatic Breast Cancer",1264 days,Recruiting,Interventional,"Experimental, Experimental, Experimental, Experimental","Drug, Drug, Drug",Sequential Assignment,Phase 1,Yes,No,54
MA-BC-II-002,Pyrotinib Plus Vinorelbine in Participants With HER2-positive Previously Treated Locally Advanced or Metastatic Breast Cancer,1288 days,Recruiting,Interventional,Experimental,"Drug, Drug, Drug",Single Group Assignment,Phase 2,No,No,208
I 2612022,Propranolol and Pembrolizumab for Tumor Re-sensitization and Treatment of Patients With Checkpoint Inhibitor Refractory Metastatic or Unresectable Triple Negative Breast Cancer,1461 days,Not yet recruiting,Interventional,Experimental,"Procedure, Procedure, Procedure, Biological, Drug, Other",Single Group Assignment,Phase 2,Yes,No,25
M21CAR,DESCARTES: De-ESCAlation of RadioTherapy in Patients With Pathologic Complete rESponse to Neoadjuvant Systemic Therapy,5418 days,Not yet recruiting,Interventional,Experimental,Radiation,Single Group Assignment,Not Applicable,No,No,595
IFOM-CPT008/2022/PO007,Restoring Sensitivity To Immunotherapy In Advanced Triple Negative Breast Cancer Exploiting Ceralasertib Priming Followed By Combined Durvalumab/Nab-Paclitaxel,1052 days,Recruiting,Interventional,Experimental,"Drug, Drug, Drug",Single Group Assignment,Phase 2,No,No,37
RG1122380,STEMVAC in Patients With Early Stage Triple Negative Breast Cancer,530 days,Recruiting,Interventional,Experimental,"Biological, Biological",Single Group Assignment,Phase 2,Yes,No,33
4070,A Study Evaluating FT-SW in Unilateral Breast Cancer-Related Lymphedema Patients,16 days,Terminated,Interventional,"Active Comparator, Experimental","Device, Device",Parallel Assignment,Not Applicable,No,Yes,2
RG1003977,Acute Exercise Intervention in Reducing Breast Cancer Risk in Healthy Participants,1193 days,Completed,Interventional,"Experimental, Active Comparator","Behavioral, Other, Other, Other",Parallel Assignment,Not Applicable,No,No,102
20190812,Succinylated Gelatin for Prevention of Fluid Retention in Patients With Breast Cancer Receiving Docetaxel Chemotherapy,395 days,Completed,Interventional,"Experimental, No Intervention",Drug,Parallel Assignment,Phase 2,No,No,216
BabesBolyaiOncovox,A Guided Online Intervention to Improve Quality of Life in Breast Cancer Patients - a Randomised Clinical Trial,167 days,Recruiting,Interventional,"Experimental, No Intervention",Behavioral,Parallel Assignment,Not Applicable,No,No,140
CADPT01A12101C,Study of Safety and Efficacy of Novel Immunotherapy Combinations in Patients With Triple Negative Breast Cancer (TNBC).,1467 days,Terminated,Interventional,"Experimental, Experimental, Experimental, Experimental","Biological, Biological, Drug, Drug, Biological, Biological",Single Group Assignment,Phase 1,Yes,No,64
V2011801,P2 Clinical Efficacy & Safety Study of V-111 Monotherapy & Sacituzumab Govitecan-hziy/V-111 Combo Therapy for mTNBC .,547 days,Withdrawn,Interventional,"Experimental, Experimental, Active Comparator","Drug, Drug, Drug",Parallel Assignment,Phase 2,Yes,No,0
R.18.02.33,Wide Margin vs. Narrow Margin in Postneoadjuvant Lumpectomy,2557 days,Recruiting,Interventional,"Experimental, Active Comparator","Procedure, Drug, Procedure, Procedure",Parallel Assignment,Phase 3,No,No,370
MCC-19-14621,Improving Exercise Capacity With Tailored Physical Activity in Lymphoma & Breast Cancer Patients Undergoing Tx,1074 days,Completed,Interventional,"Active Comparator, Active Comparator","Other, Other",Parallel Assignment,Not Applicable,No,No,12
I-19-04120,Dendritic Cell Vaccines Against Her2/Her3 and Pembrolizumab for the Treatment of Brain Metastasis From Triple Negative Breast Cancer or HER2+ Breast Cancer,1104 days,Recruiting,Interventional,Experimental,"Biological, Biological",Single Group Assignment,Phase 2,Yes,No,23
042001,"INCMGA00012 and Pelareorep for the Treatment of Metastatic Triple Negative Breast Cancer, IRENE Study",1174 days,Recruiting,Interventional,Experimental,"Biological, Other, Other, Biological",Single Group Assignment,Phase 2,Yes,No,25
767/29-09-2017,Vaginal Laser Therapy in Breast Cancer Survivors,609 days,Unknown status,Interventional,"Experimental, Placebo Comparator",Device,Parallel Assignment,Not Applicable,No,No,50
WSG-AM12,NeoAdjuvant Therapy With Trastuzumab-deruxtecan Versus Chemotherapy+Trastuzumab+Pertuzumab in HER2+ Early Breast Cancer,1919 days,Not yet recruiting,Interventional,"Experimental, Experimental, Other, Other","Drug, Drug",Crossover Assignment,Phase 2,No,No,402
STUDY00002985,Mobile Health to Improve Oral Chemotherapy Adherence Among Women With Breast Cancer,1166 days,Recruiting,Interventional,"Experimental, Active Comparator","Other, Other, Other, Other, Other",Parallel Assignment,Not Applicable,No,No,40
CSIIT-C37,Chidamide Combined With Fulvestrant for HR+/HER2-advanced Breast Cancer,489 days,Not yet recruiting,Interventional,Experimental,Drug,Single Group Assignment,Phase 2,No,No,60
i 67518,Exercise and Nutrition Education in Improving Physical Function and Quality of Life in Older Breast Cancer Survivors,788 days,Terminated,Interventional,"Experimental, Active Comparator","Other, Behavioral, Other, Other",Parallel Assignment,Not Applicable,No,No,10
HCI153239,"Functional Precision Oncology to Predict, Prevent, and Treat Early Metastatic Recurrence of TNBC",1728 days,Suspended,Interventional,"Experimental, No Intervention",Other,Parallel Assignment,Phase 2,No,No,80
268-2017,Assessment of Left-sided Cardiac Sparing Through the Use of 3-dimensional Surface Matching-based Deep Inspiration Breath Hold and Active Breathing Control,1352 days,Completed,Interventional,"Other, Other",Device,Parallel Assignment,Not Applicable,No,No,40
16-304,Study of Radiation Fractionation on Patient Outcomes After Breast REConstruction (FABREC) for Invasive Breast Carcinoma,4383 days,"Active, not recruiting",Interventional,"Experimental, Active Comparator",Radiation,Parallel Assignment,Not Applicable,No,Yes,400
2019-A02374-53,"Motivating to Exercise and Diet, and Educating to Healthy Behaviors After Breast Cancer",987 days,Unknown status,Interventional,"Experimental, No Intervention",Other,Parallel Assignment,Not Applicable,No,No,220
2022-191,Impact of Erector Spinae Plane Block on Chronic Postsurgical Pain in Breast Cancer Patients,1552 days,Not yet recruiting,Interventional,"Experimental, Sham Comparator","Procedure, Procedure",Parallel Assignment,Not Applicable,No,No,1206
NCI-2017-02320,"Fulvestrant and Palbociclib With or Without Copanlisib in Treating Patients With Hormone Receptor Positive, HER2 Negative, Stage IV Breast Cancer",0 days,Withdrawn,Interventional,"Active Comparator, Experimental","Drug, Drug, Other, Drug",Parallel Assignment,Phase 2,Yes,No,0
GIM25-CAPT,Atezolizumab Plus CArboplatin Plus Nab-paclitaxel,1461 days,Recruiting,Interventional,Experimental,Combination Product,Single Group Assignment,Phase 2,No,No,104
ELA-0121,Study of Abemaciclib and Elacestrant in Patients With Brain Metastasis Due to HR+/HER2- Breast Cancer,1188 days,Recruiting,Interventional,"Experimental, Experimental, Experimental, Experimental","Drug, Drug",Sequential Assignment,"Phase 1, Phase 2",Yes,No,106
APPI2-PT-2020-AIMSS,Targeted Physiotherapeutic Treatment for Aromatase Inhibitor-associated Musculoskeletal Pain in Breast Cancer Survivors,1142 days,Recruiting,Interventional,"Active Comparator, Active Comparator","Other, Other",Parallel Assignment,Not Applicable,No,No,120
EDP1503-101,"A Study of EDP1503 in Patients With Colorectal Cancer, Breast Cancer, and Checkpoint Inhibitor Relapsed Tumors",1047 days,Completed,Interventional,"Experimental, Experimental, Experimental","Biological, Biological",Parallel Assignment,Phase 1,Yes,No,69
187519,"Avelumab With Binimetinib, Sacituzumab Govitecan, or Liposomal Doxorubicin in Treating Patients With Stage IV or Unresectable, Recurrent Triple Negative Breast Cancer",1483 days,Recruiting,Interventional,"Experimental, Experimental, Experimental, Experimental, Experimental, Experimental","Biological, Drug, Drug, Biological, Drug, Drug",Parallel Assignment,Phase 2,Yes,No,150
OnerCengiz,The Effect of Mindfulness Program on Spiritual Well-BeingBreast Cancer Patients,274 days,Completed,Interventional,"Experimental, No Intervention",Behavioral,Parallel Assignment,Not Applicable,No,No,70
