ID,title,actual_duration,status,study_type,arm_group_type,intervention_type,interventional_type_model,phase,fda_regulated_drug,fda_regulated_device,enrollment_count
HR-BLTN-001,Pyrotinib Combined With Docetaxel in the First-line Treatment of HER2-positive MBC,641 days,Unknown status,Interventional,Experimental,Drug,Single Group Assignment,Phase 2,No,No,79
2021-A03091-40,Evaluation of the Interest of a Postural and Functional Analysis for the Follow-up of the Adapted Motor Activity of Patients Treated for Breast Cancer,1216 days,Not yet recruiting,Interventional,Experimental,Other,Single Group Assignment,Not Applicable,No,No,60
P.T.REC/012/002968,RESISTANCE VERSUS AEROBIC EXERCISES ON Breast Cancer Patients,110 days,Unknown status,Interventional,"Active Comparator, Active Comparator","Device, Other",Parallel Assignment,Not Applicable,No,No,60
IIT-2021-ASSET,Alpelisib And Sacituzumab Govitecan For Treatment Of Breast Cancer,796 days,Recruiting,Interventional,"Experimental, Experimental, Experimental","Drug, Drug",Sequential Assignment,Phase 1,Yes,No,18
4-2020-1131,Talazoparib Maintenance Therapy in Triple-negative Breast Cancer,1096 days,Not yet recruiting,Interventional,"Experimental, Active Comparator","Drug, Drug",Parallel Assignment,Phase 2,No,No,206
145358,"A Phase I/II Multicenter, Open-Label Study of Lu-177-αvβ3-IAC, for the Treatment of Angiogenic Breast Cancer Patients.",578 days,Not yet recruiting,Interventional,Experimental,Drug,Single Group Assignment,"Phase 1, Phase 2",Yes,No,100
UMCC 2018.016,The ConnectedCancerCare Pilot Study (CCC),387 days,Completed,Interventional,"Experimental, Other","Behavioral, Behavioral",Parallel Assignment,Not Applicable,No,No,66
TP.102.17.22.PAR,Pilot Clinical Evaluation of a Microwave Imaging System for Breast Cancer Detection,632 days,Recruiting,Interventional,Experimental,Device,Single Group Assignment,Not Applicable,No,No,103
EFC15935,Amcenestrant (SAR439859) Plus Palbociclib as First Line Therapy for Patients With ER (+) HER2(-) Advanced Breast Cancer,1171 days,"Active, not recruiting",Interventional,"Experimental, Active Comparator","Drug, Drug, Drug, Drug, Drug, Drug",Parallel Assignment,Phase 3,Yes,No,1068
BC-NEO-IIT-SHR6390,SHR6390 Combined With Anastrozole for Preoperative Treatment of Breast Cancer.,606 days,Completed,Interventional,Experimental,Drug,Single Group Assignment,Phase 2,No,No,20
GDWCH-001,Tucidinostat and Fulvestrant in Hormone-receptor Positive Advanced Breast Cancer,1155 days,Not yet recruiting,Interventional,Experimental,"Drug, Drug",Single Group Assignment,Phase 2,No,No,73
SMC-2018-10-062,Feasibility of a Modular mHealth for Tailored Rehabilitation of Breast Cancer,708 days,Completed,Interventional,"Experimental, No Intervention",Behavioral,Parallel Assignment,Not Applicable,No,No,44
SMX 18001,Evaluation of Lasofoxifene Versus Fulvestrant in Advanced or Metastatic ER+/HER2- Breast Cancer With an ESR1 Mutation,1595 days,"Active, not recruiting",Interventional,"Experimental, Active Comparator","Drug, Drug",Parallel Assignment,Phase 2,Yes,No,100
NRG-BR008,Testing Radiation and HER2-targeted Therapy Versus HER2-targeted Therapy Alone for Low-risk HER2-positive Breast Cancer,5074 days,"Active, not recruiting",Interventional,"Active Comparator, Active Comparator","Radiation, Drug",Parallel Assignment,Phase 3,No,No,1300
TEBICA002,Breast Cancer Neoantigen Vaccination With Autologous Dendritic Cells,915 days,Completed,Interventional,Experimental,Biological,Single Group Assignment,Phase 1,No,No,5
CWCD118B12201,Phase II Study Evaluating the Efficacy and Safety of Ociperlimab in Combination With Tislelizumab and Chemotherapy as First-line Treatment for Participants With Advanced Triple Negative Breast Cancer,2133 days,Not yet recruiting,Interventional,"Experimental, Active Comparator, Active Comparator, Other","Drug, Drug, Drug, Drug, Drug, Drug, Drug, Drug",Parallel Assignment,Phase 2,Yes,No,250
CALORIE,Capecitabine in the Treatment of Breast Cancer With Low-hormone Receptor Expression After Neoadjuvant Chemotherapy,731 days,Unknown status,Interventional,"Experimental, Placebo Comparator","Drug, Drug",Parallel Assignment,Not Applicable,No,No,50
S2010,"Monitoring Symptoms to Help Young Women Take Hormone Therapy for Stage I-III Breast Cancer, ASPEN Study",1860 days,Recruiting,Interventional,"Experimental, Active Comparator","Other, Procedure, Procedure, Behavioral, Other, Other",Parallel Assignment,Not Applicable,No,No,540
2019-A01592-55,Transcutaneous Breast Cancer Diagnosis by Canine Odorology,1517 days,Suspended,Interventional,Experimental,Diagnostic Test,Single Group Assignment,Not Applicable,No,No,450
ABY-025-MI301,A Study of 68Ga-ABY-025 PET for Non-invasive Quantification of HER2-expression in Advanced Breast Cancer,2628 days,Recruiting,Interventional,Experimental,Diagnostic Test,Single Group Assignment,Not Applicable,No,No,160
202202045MIPA,Olaparib Maintenance Therapy in Metastatic Breast Cancer,1115 days,Recruiting,Interventional,"Experimental, Active Comparator","Drug, Drug",Parallel Assignment,Phase 2,No,No,300
22-07025006,Diabetes Care for Breast Cancer Patients,1379 days,Recruiting,Interventional,"Experimental, No Intervention",Behavioral,Parallel Assignment,Not Applicable,No,No,76
2019/044,Evaluation of the Effect of Mediterranean Diet on Breast Cancer Patients,456 days,Completed,Interventional,Experimental,Behavioral,Single Group Assignment,Not Applicable,No,No,25
B2017-11,Neoadjuvant Goserelin for Triple Negative Breast Cancer,1826 days,Unknown status,Interventional,"Experimental, No Intervention",Drug,Parallel Assignment,Phase 2,No,No,180
Pro00088926,Promoting Breast Cancer Screening in Women Who Survived Childhood Cancer,1334 days,"Active, not recruiting",Interventional,"Experimental, Experimental, Active Comparator","Behavioral, Behavioral, Behavioral",Parallel Assignment,Not Applicable,No,No,320
Tmab-TK006-102b,Safety Assessment of Repeated Administration of TK006 in Patients With Breast Cancer-related Bone Metastases,365 days,Unknown status,Interventional,Experimental,Biological,Single Group Assignment,Phase 1,No,No,30
Ahead-BC-20170323,Clinical Study of Apatinib Combined With SBRT Therapy in the Treatment of Oligometastasis of Breast Cancer,731 days,Unknown status,Interventional,Experimental,"Drug, Radiation",Single Group Assignment,Phase 2,No,No,30
21090645,Omega-3 and Vitamin D Supplementation in Breast Cancer Women,254 days,Recruiting,Interventional,"Experimental, Experimental, Experimental, No Intervention","Dietary Supplement, Dietary Supplement, Combination Product",Parallel Assignment,Early Phase 1,No,No,88
18-0234,The REACH Study: A Novel Values-Based Intervention to Increase Endocrine Therapy Adherence Among Breast Cancer Survivors,518 days,Completed,Interventional,"Experimental, Active Comparator","Behavioral, Behavioral",Parallel Assignment,Not Applicable,No,No,88
P20CA217199-9492018,A Community Dance Intervention Engaging Breast Cancer Survivors in a Middle-income Country,549 days,Completed,Interventional,"Experimental, No Intervention",Behavioral,Parallel Assignment,Not Applicable,No,No,64
Pro00107216,The Effect of Intermittent Fasting on Body Composition in Women With Breast Cancer,607 days,Withdrawn,Interventional,Experimental,Behavioral,Single Group Assignment,Not Applicable,No,No,0
HREBA.CC 19-0363,Rise Up After Breast Cancer,243 days,Completed,Interventional,Experimental,"Behavioral, Behavioral",Single Group Assignment,Not Applicable,No,No,12
AHQU-2021004,Acupuncture for Stiffness of Joint Related to Aromatase Inhibitors in Patients With Early-Stage Breast Cancer,589 days,Recruiting,Interventional,Experimental,Device,Single Group Assignment,Not Applicable,No,No,52
H20-03123,Breast Cancer Endocrine Therapy FITness (BE-FIT) Trial.,1021 days,Recruiting,Interventional,"Experimental, Experimental","Behavioral, Behavioral",Crossover Assignment,Not Applicable,No,No,132
SYS-C-201801-5010,Fulvestrant Versus Capecitabine as Maintenance Therapy After First-line Chemotherapy in Patients With HR+/HER2- Metastatic Breast Cancer,4383 days,Recruiting,Interventional,"Experimental, Active Comparator","Drug, Drug",Parallel Assignment,Phase 3,No,No,210
15-017,Imaging Markers of Subclinical Cardiotoxicity in Breast Cancer,1390 days,Unknown status,Interventional,Experimental,"Other, Other",Single Group Assignment,Not Applicable,No,No,190
ZN-c5-003,A Study of ZN-c5 and Abemaciclib in Participants With Breast Cancer,711 days,Completed,Interventional,Experimental,"Drug, Drug",Single Group Assignment,Phase 1,Yes,No,14
M14ABC,"A Feasibility Study of Niraparib for Advanced, BRCA1-like, HER2-negative Breast Cancer Patients",1508 days,Terminated,Interventional,Experimental,Drug,Single Group Assignment,Phase 2,No,No,9
18-004803,Evaluation of Magseed as Localization Device for Biopsy Proven Metastatic Axillary Lymph Nodes,397 days,Terminated,Interventional,Experimental,Device,Single Group Assignment,Not Applicable,No,Yes,1
34615/4/21,The Possible Efficacy and Safety of Lansoprazole Co-administration With Neoadjuvant Chemotherapy in Women With Breast Cancer,513 days,Completed,Interventional,"Active Comparator, Placebo Comparator","Drug, Drug",Parallel Assignment,Phase 3,No,No,66
CLAG525B2101,"A Study of Efficacy and Safety of LAG525 in Combination With Spartalizumab, or With Spartalizumab and Carboplatin, or With Carboplatin, in Patients With Advanced Triple-negative Breast Cancer",1241 days,Completed,Interventional,"Experimental, Experimental, Experimental","Drug, Drug, Drug",Parallel Assignment,Phase 2,Yes,No,88
MINERVA,Combination of Abemaciclib and Endocrine Therapy in Hormone Receptor Positive HER2 Negative Locally Advanced or Metastatic Breast Cancer With Focus on Digital Side Effect Management,1435 days,Recruiting,Interventional,"Experimental, Experimental","Drug, Drug",Parallel Assignment,Phase 4,Yes,No,300
LACOG 0419,Evaluation of Sequencing of Anthracyclines and Taxanes for Locally Advanced HER2-negative Breast Cancer,3145 days,Recruiting,Interventional,"Active Comparator, Experimental","Drug, Drug",Parallel Assignment,Phase 3,No,No,494
CHB18.04,Quality of Life and Sexuality of Patients Over 65 Years Undergoing Adjuvant Treatment for Breast Cancer,1186 days,Completed,Interventional,Other,Other,Single Group Assignment,Not Applicable,No,No,14
CSIIT-C21,A Clinical Study of the Efficacy and Safety of Chidamide in Combination With Camrelizumab and Carboplatin or Capecitabine in the Second and Third Line Treatment of Relapsed/Metastatic Triple-negative Breast Cancer,731 days,Not yet recruiting,Interventional,"Experimental, Experimental","Drug, Drug, Drug, Drug",Parallel Assignment,Phase 2,No,No,70
BOOG 2018-01,Image-guided De-escalation of Neo-adjuvant Chemotherapy in HER2-positive Breast Cancer: the TRAIN-3 Study,4812 days,"Active, not recruiting",Interventional,Experimental,Drug,Single Group Assignment,Phase 2,No,No,462
AMC2020-17,Upper Limb Function After Breast Cancer Surgery: the Role of Post-operative Physical Therapy Intervention,427 days,Completed,Interventional,"Active Comparator, Active Comparator, Active Comparator, Active Comparator",Other,Parallel Assignment,Not Applicable,No,No,160
KY20222062-C-1,"Neoadjuvant Inituomab, Pyrrolidone and Nab-paclitaxel for HER2+Breast Cancer",425 days,Not yet recruiting,Interventional,Experimental,Drug,Single Group Assignment,Phase 2,No,No,20
20201540,Prospective Evaluation of Targeted Axillary Dissection (TAD),1096 days,Recruiting,Interventional,Experimental,Procedure,Single Group Assignment,Not Applicable,No,No,45
RCVDBCIIR005,Disitamab Vedotin(RC48) Combined With Penpulimab(AK105) for Neoadjuvant Treatment of HER2-low Breast Cancer,549 days,Not yet recruiting,Interventional,Experimental,"Drug, Drug",Single Group Assignment,Phase 2,No,No,20
STUDY00003282,Oral SM-88 in Patients With Metastatic HR+/HER2- Breast Cancer,1317 days,"Active, not recruiting",Interventional,Experimental,Drug,Single Group Assignment,Phase 2,Yes,No,50
IRB-2022-348,Transversus Thoracic Muscle Plane Combined With Pectoral Nerves Block for Breast Cancer Surgery,422 days,Not yet recruiting,Interventional,"Experimental, Active Comparator","Procedure, Procedure",Parallel Assignment,Not Applicable,No,No,116
LCCC 1639,"Window of Opportunity Trial of Entinostat in Patients With Newly Diagnosed Stage I-IIIC,TNBC",317 days,Terminated,Interventional,Experimental,Drug,Single Group Assignment,Early Phase 1,Yes,No,5
SCHBCC-N034,Stage I HER2 Positive Invasive Breast Cancer De-escalation Study(IRIS-C/D),1825 days,Not yet recruiting,Interventional,"Experimental, Experimental","Drug, Drug",Single Group Assignment,Phase 2,No,No,356
2022-0431,A Phase II Study of Neoadjuvant Sacituzumab Govitecan and Pembrolizumab Therapy for Immunochemotherapy-resistant Early-stage Triple-negative Breast Cancer (TNBC),273 days,Not yet recruiting,Interventional,Experimental,"Drug, Drug",Single Group Assignment,Phase 2,Yes,No,25
CBYL719C1201,Study Assessing the Efficacy and Safety of Treatment With Alpelisib Plus Fulvestrant in Japanese Men and Postmenopausal Women With Advanced Breast Cancer,2507 days,Recruiting,Interventional,"Experimental, Experimental, Experimental","Drug, Drug",Parallel Assignment,Phase 2,No,No,50
SYSA1802-CSP-006,A Study to Evaluate the Efficacy and Safety of SG001 in Combination With Nab-Paclitaxel in Patients With Advanced Triple-Negative Breast Cancer (TNBC),730 days,Recruiting,Interventional,Experimental,"Drug, Drug",Single Group Assignment,Phase 2,No,No,79
KY2019-023,Neoadjuvant Study of Pyrotinib in HER-2 Positive Breast Cancer,2693 days,"Active, not recruiting",Interventional,Experimental,Drug,Single Group Assignment,Phase 2,No,No,53
MEDOPP447,Margetuximab Plus Tucatinib and Capecitabine in HER2-positive Metastatic Breast Cancer,870 days,Withdrawn,Interventional,Experimental,"Drug, Drug, Drug",Single Group Assignment,Phase 2,No,No,0
GE-226-004,Study to Evaluate Safety and Dosimetry of [18F]GEH121224 in Patients With Locally Advanced or Metastatic Breast Cancer,366 days,Not yet recruiting,Interventional,"Experimental, Experimental","Drug, Diagnostic Test, Diagnostic Test",Sequential Assignment,Phase 1,Yes,No,12
2021P002871,Optimizing Functional Recovery of Breast Cancer Survivors,1311 days,"Active, not recruiting",Interventional,"Experimental, Active Comparator","Behavioral, Behavioral",Parallel Assignment,Not Applicable,No,No,300
CABC - Kreftfor project - SEB,Coping After Breast Cancer - a Randomized Clinical Trial With Two Digital Interventions,5463 days,Recruiting,Interventional,"Active Comparator, Active Comparator, Placebo Comparator","Other, Other, Other",Parallel Assignment,Not Applicable,No,No,390
201708076,Mindful Movement in Women Receiving Adjuvant or Neoadjuvant Therapy for Breast Cancer,532 days,Completed,Interventional,"Experimental, Active Comparator","Other, Procedure, Behavioral, Procedure, Behavioral, Behavioral",Parallel Assignment,Not Applicable,No,No,30
TWT-203,"CFI-402257, a Potent and Selective TTK Inhibitor, in Solid Tumors and With Fulvestrant in Breast Cancer",1162 days,Recruiting,Interventional,"Experimental, Experimental","Drug, Drug",Sequential Assignment,"Phase 1, Phase 2",Yes,No,44
CO41101,A Study Of Ipatasertib in Combination With Atezolizumab and Paclitaxel as a Treatment for Participants With Locally Advanced or Metastatic Triple-Negative Breast Cancer.,1191 days,Completed,Interventional,"Experimental, Experimental, Active Comparator, Experimental, Active Comparator","Drug, Drug, Drug, Drug, Drug",Parallel Assignment,Phase 3,Yes,No,242
EA1183,"Using FDG-PET/CT to Assess Response of Bone-Dominant Metastatic Breast Cancer, FEATURE Study",2707 days,Recruiting,Interventional,Experimental,"Procedure, Other, Procedure",Single Group Assignment,Phase 2,No,No,134
WO42312,"A Study Evaluating the Efficacy and Safety of Giredestrant Compared With Physicians Choice of Endocrine Monotherapy in Participants With Previously Treated Estrogen Receptor-Positive, HER2-Negative Locally Advanced or Metastatic Breast Cancer (acelERA Breast Cancer)",1095 days,"Active, not recruiting",Interventional,"Experimental, Active Comparator","Drug, Drug, Drug",Parallel Assignment,Phase 2,Yes,No,303
NHP,Neoadjuvant Study of Navelbine in Patients With HER2 Positive Breast Cancer,729 days,Unknown status,Interventional,"Experimental, Active Comparator","Drug, Drug",Parallel Assignment,Phase 3,No,No,50
JU 2020/1732-51,Digi-Do - a Digital Information Tool to Help Patients Diagnosed With Breast Cancer,1216 days,"Active, not recruiting",Interventional,"Experimental, No Intervention",Behavioral,Parallel Assignment,Not Applicable,No,No,80
NCCH1607,"PAlbociclib Plus Tamoxifen for the Treatment of Hormone Receptor-positive, HER2-negative Advanced Breast Cancer Women - Asian studY",2608 days,"Active, not recruiting",Interventional,"Experimental, Active Comparator","Drug, Drug, Drug, Drug",Parallel Assignment,Phase 3,Yes,No,180
NL69081.041.19,The Effect of Hyperbaric OxygeN Therapy on brEast Cancer Patients With Late Radiation toxicitY - UMBRELLA HONEY Trial,1465 days,Recruiting,Interventional,"Experimental, No Intervention",Drug,Parallel Assignment,Phase 3,No,No,120
AAAS2359,Family-Based Intervention Study of the Effects of Environmental Exposures on Breast Tissue Composition,366 days,Unknown status,Interventional,"Experimental, No Intervention",Behavioral,Parallel Assignment,Not Applicable,No,No,90
HSEARS20210816002,The Effects of a Nurse-led mHealth Program for Symptom Self-management of Breast Cancer Patients Undergoing Chemotherapy,266 days,Recruiting,Interventional,"Experimental, No Intervention",Device,Parallel Assignment,Not Applicable,No,No,76
D926XC00001,A Study of Dato-DXd With or Without Durvalumab Versus Investigators Choice of Therapy in Patients With Stage I-III Triple-negative Breast Cancer Without Pathological Complete Response Following Neoadjuvant Therapy (TROPION-Breast03),2676 days,Recruiting,Interventional,"Experimental, Experimental, Active Comparator","Drug, Drug, Drug, Drug",Parallel Assignment,Phase 3,Yes,No,1075
HRS-8080-I-101,A Trial of HRS-8080 Tablets in Metastatic or Local Advanced Breast Cancer of Adults,1260 days,Enrolling by invitation,Interventional,Experimental,Drug,Single Group Assignment,Phase 1,No,No,156
ONA-XR-103,Study of Elacestrant in Combination With Onapristone in Patients With Advanced or Metastatic Breast Cancer,1245 days,"Active, not recruiting",Interventional,Experimental,"Drug, Drug",Single Group Assignment,"Phase 1, Phase 2",Yes,No,67
2022-0315,Phase 1b Study of EZH1/2 Inhibitor Valemetostat in Combination With Trastuzumab Deruxtecan in Subjects With HER2 Low/Ultra-low/Null Metastatic Breast Cancer,3613 days,Recruiting,Interventional,"Experimental, Experimental","Drug, Drug",Single Group Assignment,Phase 1,Yes,No,37
KCSG BR19-13,High Risk ER+HER2- T1-2N0-1 Early Breast Cancer With Palbociclib Plus Endocrine Therapy(HIPEx),1817 days,Recruiting,Interventional,Experimental,Drug,Single Group Assignment,Phase 2,No,No,578
STU00216520,Web-based Pain Coping Skills Training for Breast Cancer Survivors With AI-Associated Arthralgia,1411 days,Recruiting,Interventional,"Experimental, Active Comparator","Behavioral, Other",Parallel Assignment,Phase 3,No,No,452
20805,BATs in Patients With Breast Cancer and Leptomeningeal Metastases,1022 days,Terminated,Interventional,Experimental,Drug,Single Group Assignment,Phase 1,Yes,No,3
ICO-2020-25,Imaging Performance Assessment of 89Zirconium-labelled Girentuximab (89Zr-TLX250) PET-CT in Metastatic Triple Negative Breast Cancer Patients,984 days,Recruiting,Interventional,Experimental,Drug,Single Group Assignment,Phase 2,No,No,12
HRS-1358-I-101,A Trial of HRS-1358 Tablets in Metastatic or Local Advanced Breast Cancer,874 days,Enrolling by invitation,Interventional,Experimental,Drug,Single Group Assignment,Phase 1,No,No,102
IRFMN-BRC-7103,Neoadjuvant Zoledronate and Atorvastatin in Triple Negative Breast Cancer,1968 days,"Active, not recruiting",Interventional,"Active Comparator, Experimental","Drug, Drug, Drug",Parallel Assignment,Phase 2,No,No,54
BL-M02D1-101,A Study of BL-M02D1 in Patients With Locally Advanced or Metastatic Triple Negative Breast Cancer or Other Solid Tumors,712 days,Recruiting,Interventional,Experimental,Drug,Sequential Assignment,Phase 1,No,No,26
RJBC1901,Pyrotinib or Trastuzumab Plus Nab-paclitaxel as Neoadjuvant Therapy in HER2-positive Breast Cancer,234 days,Terminated,Interventional,"Experimental, Active Comparator","Drug, Drug, Drug, Drug, Procedure",Parallel Assignment,Phase 2,No,No,12
PELICAN-IPC 2015-016,Study of Immunotherapy in Combination With Chemotherapy in HER2-negative Inflammatory Breast Cancer,2472 days,Recruiting,Interventional,"Experimental, Active Comparator","Drug, Drug",Parallel Assignment,Phase 2,Yes,No,81
852000,FES BPET-DBT in Newly Diagnosed Breast Cancer,1006 days,Not yet recruiting,Interventional,Experimental,"Device, Drug",Single Group Assignment,Early Phase 1,Yes,Yes,20
YO41137,"A Two-Arm Study to Evaluate the Pharmacokinetics, Efficacy, and Safety of Subcutaneous Administration of the Fixed-Dose Combination of Pertuzumab and Trastuzumab in Combination With Chemotherapy in Chinese Participants With HER2-Positive Early Breast Cancer",2106 days,"Active, not recruiting",Interventional,"Active Comparator, Experimental","Drug, Drug, Drug, Drug, Drug, Drug, Procedure, Radiation, Drug",Parallel Assignment,Phase 3,Yes,No,200
BC2,A Study to Evaluate the Efficacy and Safety of Oral Navelbine in Female Patients With HER2-Negative Metastatic Breast Cancer,2495 days,Not yet recruiting,Interventional,"Experimental, Active Comparator","Drug, Drug",Parallel Assignment,Phase 2,Yes,No,172
CO40016,"A Study of Ipatasertib in Combination With Paclitaxel as a Treatment for Participants With PIK3CA/AKT1/PTEN-Altered, Locally Advanced or Metastatic, Triple-Negative Breast Cancer or Hormone Receptor-Positive, HER2-Negative Breast Cancer",1824 days,Completed,Interventional,"Experimental, Experimental","Drug, Drug, Drug",Parallel Assignment,Phase 3,Yes,No,580
ADIGYN,Interest of Circulating Tumor DNA in Digestive and Gynecologic/Breast Cancer,3511 days,Recruiting,Interventional,Experimental,Diagnostic Test,Single Group Assignment,Not Applicable,No,No,1000
NICSO-GINSENG,American Ginseng for the Prevention of Moderate-severe Fatigue in Breast Cancer Patients,611 days,Unknown status,Interventional,"Experimental, Placebo Comparator","Dietary Supplement, Other",Parallel Assignment,Not Applicable,No,No,290
ATADEK-2018 / 9,KİNECT® - Video Games Based Physiotherapy Programme in Patients With Breast Cancer Surgery,336 days,Completed,Interventional,"Experimental, Active Comparator","Other, Other",Parallel Assignment,Not Applicable,No,No,34
UW22095,Intervention to Improve the Delivery of Follow-up Care for Low-Risk Breast Cancer,1081 days,Recruiting,Interventional,"Experimental, No Intervention",Other,Parallel Assignment,Not Applicable,No,No,100
HREBA.CC-18-0657,Diet Restriction and Exercise-induced Adaptations in Metastatic Breast Cancer,1713 days,Enrolling by invitation,Interventional,"Experimental, No Intervention",Behavioral,Parallel Assignment,Not Applicable,No,No,50
NSABP FB-12,Study of Neoadjuvant Chemotherapy Plus Trastuzumab and Pertuzumab in HER2-Negative Breast Cancer Patients With Abnormal HER2 Signaling,1995 days,Recruiting,Interventional,Experimental,"Drug, Drug, Drug, Drug, Drug, Diagnostic Test",Single Group Assignment,Phase 2,Yes,Yes,64
4469,PIK3CA in HER2+ BC and pCR Trial,487 days,"Active, not recruiting",Interventional,Experimental,Genetic,Single Group Assignment,Not Applicable,No,No,58
STUDY00018504,"Olaparib in Combination With Either Durvalumab, Selumetinib, or Capivasertib or Ceralasertib Alone in Treating Patients With Metastatic Triple Negative Breast Cancer",2941 days,Recruiting,Interventional,"Experimental, Experimental, Experimental, Experimental","Procedure, Drug, Drug, Biological, Drug, Other, Drug",Parallel Assignment,Phase 2,Yes,No,132
YOUNGBC-19,Chidamide in Combination With Abemaciclib and Fulvestrant in Breast Cancer Patients Previously Treated With Palbociclib,304 days,Recruiting,Interventional,Experimental,"Drug, Drug, Drug",Single Group Assignment,"Phase 1, Phase 2",No,No,44
CCR5316,A Trial of Early Detection of Molecular Relapse With Circulating Tumour DNA Tracking and Treatment With Palbociclib Plus Fulvestrant Versus Standard Endocrine Therapy in Patients With ER Positive HER2 Negative Breast Cancer,3077 days,Recruiting,Interventional,"Active Comparator, Experimental","Drug, Drug, Drug, Drug, Drug, Drug",Parallel Assignment,Phase 2,No,No,1100
STUDY00000675,Fluciclovine and PSMA PET/CT for the Classification and Improved Staging of Invasive Lobular Breast Cancer,1264 days,Recruiting,Interventional,Experimental,"Procedure, Drug, Drug, Procedure",Single Group Assignment,Phase 1,Yes,No,20
FILBLAU1022,Effectiveness and Safety Study of Filgrastine® in Patientes With Breast Cancer Treated With Myelotoxic Chemotherapy,580 days,Not yet recruiting,Interventional,"Active Comparator, Experimental","Biological, Biological",Parallel Assignment,Phase 3,No,No,60
CBYL719C2303,"Study to Assess the Efficacy and Safety of Alpelisib Plus Fulvestrant in Participants With HR-postitive (HR+), HER2-negative, Advanced Breast Cancer After Treatment With a CDK4/6 Inhibitor and an Aromatase Inhibitor.",1759 days,Recruiting,Interventional,"Experimental, Placebo Comparator","Drug, Drug, Drug",Crossover Assignment,Phase 3,No,No,234
BC-IIT-SHR6390-FMTN,A Study of SHR6390 Combined With Famitinib in the Treatment of HR + / HER2- Advanced Breast Cancer.,857 days,"Active, not recruiting",Interventional,Experimental,"Drug, Drug",Single Group Assignment,Phase 2,No,No,35
LV,"Breast Cancer, Omics, and Precision Medicine",699 days,Not yet recruiting,Interventional,"Experimental, No Intervention",Biological,Factorial Assignment,Phase 2,No,No,200
