ID,title,actual_duration,status,study_type,arm_group_type,intervention_type,interventional_type_model,phase,fda_regulated_drug,fda_regulated_device,enrollment_count
MCC-19-15167,Improving Uptake of Genetic Cancer Risk Assessment in African American Women- Video,790 days,Recruiting,Interventional,"No Intervention, Active Comparator",Behavioral,Parallel Assignment,Not Applicable,No,No,70
CASE5117,Drain-Less Abdominally Based Breast Reconstruction Using Lysine-Derived Urethane Adhesive,304 days,Withdrawn,Interventional,"Active Comparator, Experimental, Active Comparator","Device, Device, Other",Parallel Assignment,Not Applicable,No,Yes,0
CASE10117,Bupivacaine Versus Liposomal Bupivacaine For Breast Pain Management After Breast Recontruction,824 days,Withdrawn,Interventional,"Experimental, Active Comparator","Drug, Drug, Drug, Drug",Parallel Assignment,Phase 2,Yes,No,0
Medipol Hospital 18,ESPB and RIB for Pain Management Following Mastectomy Surgery,307 days,Completed,Interventional,"Active Comparator, Active Comparator",Other,Parallel Assignment,Not Applicable,No,No,60
18-431,Randomized Study of Stereotactic Body Radiation Therapy (SBRT) in Patients With Oligoprogressive Metastatic Cancers of the Breast and Lung,1811 days,"Active, not recruiting",Interventional,"Experimental, Active Comparator","Radiation, Drug",Parallel Assignment,Phase 2,Yes,No,107
SPI-POZ-203,A Study of Poziotinib in Patients With Epidermal Growth Factor Receptor (EGFR) or Human Epidermal Growth Factor Receptor 2 (HER2) Activating Mutations in Advanced Malignancies,827 days,Terminated,Interventional,"Experimental, Experimental, Experimental, Experimental, Experimental","Drug, Drug",Single Group Assignment,Phase 2,Yes,No,1
STUDY21070030,CEM to Reduce Biopsy Rates for Less Than Highly Suspicious Breast Abnormalities: a Prospective Study,1734 days,Recruiting,Interventional,Experimental,"Device, Drug",Single Group Assignment,Phase 4,Yes,Yes,1855
E2018124,Application of Intra-operative Prophylactic Antibiotics/Antiseptics in Chinese Breast Reconstruction Patients,1233 days,Unknown status,Interventional,"No Intervention, Experimental, Experimental",Drug,Parallel Assignment,Not Applicable,No,No,291
2140-002,A Study of Zilovertamab Vedotin (MK-2140) (VLS-101) in Participants With Solid Tumors (MK-2140-002),1042 days,"Active, not recruiting",Interventional,Experimental,Drug,Single Group Assignment,Phase 2,Yes,No,210
21-288,A Study of Mirdametinib on Its Own or in Combination With Fulvestrant in People With Solid Tumor Cancer,1096 days,Recruiting,Interventional,"Experimental, Experimental, Experimental, Experimental","Drug, Drug",Parallel Assignment,"Phase 1, Phase 2",Yes,No,150
RadOnc,Combined Optical and Infrared Imaging for Early Prediction of Erythema During Breast and Chestwall Radiotherapy,883 days,Unknown status,Interventional,Experimental,Other,Single Group Assignment,Not Applicable,No,No,150
INX-315-01,"Open-Label Study to Evaluate the Safety, Tolerability, PK, and Efficacy of INX-315 in Patients With Advanced Cancer",1161 days,Recruiting,Interventional,"Experimental, Experimental, Experimental",Drug,Sequential Assignment,"Phase 1, Phase 2",Yes,No,81
JSKN003-101,First-In-Human Study in Subjects With Advanced or Metastatic Solid Malignant Tumors,850 days,Recruiting,Interventional,Experimental,Drug,Sequential Assignment,Phase 1,No,No,45
228012,Impact of Topical Tranexamic Acid in Breast Reconstruction,550 days,Recruiting,Interventional,Experimental,"Drug, Other",Single Group Assignment,Phase 4,Yes,No,150
20-275,Testing a New Imaging Agent to Identify Cancer,1461 days,Recruiting,Interventional,Experimental,Combination Product,Single Group Assignment,Phase 1,Yes,No,20
IGAR-TO-007,IGAR-Breast TeleOp Trial,364 days,Unknown status,Interventional,Experimental,Device,Single Group Assignment,Not Applicable,No,No,10
Laser LabCorp #001,Real-time Diagnosis and Visualization of Tumor Margins in Excised Breast Specimens Using Zenith FLIM Diagnostics,322 days,Suspended,Interventional,Experimental,Diagnostic Test,Single Group Assignment,Not Applicable,No,No,100
2020-04936,Mammography Screening With Artificial Intelligence (MASAI),1461 days,"Active, not recruiting",Interventional,"Experimental, Experimental","Other, Other",Parallel Assignment,Not Applicable,No,No,100000
IRB-50877,Pilot Breast-Dedicated PET Camera With 1 Millimeter Spatial Resolution,334 days,Not yet recruiting,Interventional,Experimental,"Drug, Device",Single Group Assignment,Early Phase 1,Yes,Yes,20
PER-19-04,Wide Field OCT + AI for Positive Margin Rates in Breast Conservation Surgery.,639 days,Recruiting,Interventional,"No Intervention, Experimental",Device,Parallel Assignment,Not Applicable,No,Yes,333
KL166-I-01-CTP,A Study of A166 in Patients With Advanced Solid Malignant Tumors,1970 days,Recruiting,Interventional,"Experimental, Experimental",Drug,Sequential Assignment,Phase 1,No,No,120
PROTOCOL-P2-054,The ABC Study: Assessment of Breast Density Classification,257 days,Recruiting,Interventional,Other,Device,Single Group Assignment,Not Applicable,No,No,800
254-18,Reconstructions With Back Donor Site Flaps and Validation of Quality of Life Scales,1978 days,Recruiting,Interventional,"Active Comparator, Active Comparator, Active Comparator","Procedure, Procedure, Procedure",Parallel Assignment,Not Applicable,No,No,550
B076201420067,Zhongnan Hospital of Wuhan University,656 days,Unknown status,Interventional,"Active Comparator, Experimental",Drug,Parallel Assignment,Not Applicable,No,No,124
MIP-2019-001,BIOpsychosocial Approach of the CAncer-RElated FAtigue (BIOCARE FActory),1247 days,Not yet recruiting,Interventional,Experimental,Other,Single Group Assignment,Not Applicable,No,No,200
21051,Incorporating ePrognosis for the Encouragement of Smarter Screening for Breast and Colorectal Cancer in Older Adults,310 days,Completed,Interventional,"Experimental, Active Comparator","Other, Other, Other, Other",Parallel Assignment,Not Applicable,No,No,75
DE-17-17,Clinical Investigation to Evaluate the Ability of MammoWave in Breast Lesions Detection,338 days,Completed,Interventional,Other,Device,Single Group Assignment,Not Applicable,No,No,353
201701045,Optimizing Decision Making About Breast Reconstruction After Mastectomy: A Patient-Centered Approach,288 days,Completed,Interventional,"Experimental, Active Comparator","Other, Other, Other, Other, Other",Parallel Assignment,Phase 1,No,No,120
E20210210,Breast Mesh Used in Two-staged Breast Reconstruction,1826 days,Recruiting,Interventional,"Experimental, Active Comparator","Procedure, Procedure",Parallel Assignment,Not Applicable,No,No,300
EMC-0124-18,Evaluation of the SmartBx System for Breast Biopsy,83 days,Completed,Interventional,Experimental,Device,Single Group Assignment,Not Applicable,No,No,30
LYL797-101,A Study to Investigate LYL797 in Adults With Solid Tumors,1617 days,Recruiting,Interventional,Experimental,Biological,Single Group Assignment,Phase 1,Yes,No,54
2834,TIVA Admnistration and Autologous Fat Transfer in Breast Reconstruction,211 days,Completed,Interventional,"Experimental, Experimental",Drug,Parallel Assignment,Not Applicable,No,No,46
IC 2021 07,Opioid Free Versus Opioid Based Anaesthesia for Secondary Free Flap Reconstruction Surgery of the Breast: A Phase III Multicentric Randomized Controlled Study.,1194 days,Recruiting,Interventional,"Experimental, No Intervention",Drug,Parallel Assignment,Phase 3,No,No,158
GEN1B-01,Clinical Evaluation of Opto-Acoustic Image Quality With the Gen1B Duplex Probe in Breast Applications,742 days,Suspended,Interventional,"Active Comparator, Active Comparator","Device, Device",Sequential Assignment,Not Applicable,No,Yes,4
IIT2018-25-MITA-NEOBREADS,NEOBREADS: Neoadjuvant Breast Diet Study,880 days,Terminated,Interventional,Experimental,"Other, Drug",Single Group Assignment,Phase 1,No,No,2
2020-00493,Red Bull Energy Drink Intake After Autologous Microsurgical Breast Reconstruction,965 days,Recruiting,Interventional,"Experimental, Placebo Comparator","Dietary Supplement, Other",Parallel Assignment,Not Applicable,No,No,100
20210817-01H,TAP vs QL for Postoperative Analgesia After DIEP Free Flap Breast Reconstruction,334 days,Not yet recruiting,Interventional,"Active Comparator, Active Comparator","Procedure, Procedure",Parallel Assignment,Not Applicable,No,No,46
CIRB Ref. No: 2019/2090,Accessible Cancer Care to Enable Support for Survivors Programme,731 days,Unknown status,Interventional,"Experimental, Placebo Comparator","Other, Other",Parallel Assignment,Not Applicable,No,No,226
20295,Dermacell ADM Without Basement Membrane,973 days,Unknown status,Interventional,"Experimental, Active Comparator","Procedure, Procedure",Parallel Assignment,Not Applicable,No,No,120
TO-TAS0728-101,A Study of TAS0728 in Patients With Solid Tumors With HER2 or HER3 Abnormalities,1525 days,Terminated,Interventional,Experimental,Drug,Sequential Assignment,Phase 1,Yes,No,19
124.03-2017-GES-0005,Patient-Assisted Compression in 3D - Impact on Image Quality and Workflow,5 days,Completed,Interventional,Other,"Device, Device",Single Group Assignment,Not Applicable,No,Yes,36
IIT2018-21-AMERSI-BREADS,BREADS: Breast Adjuvant Diet Study,1427 days,Recruiting,Interventional,"Experimental, Active Comparator","Other, Drug",Parallel Assignment,Phase 2,No,No,40
3-2021-0468,Pectoralis Nerve Block and Quality of Recovery in Mastectomy Patients,1125 days,Recruiting,Interventional,"Experimental, Placebo Comparator","Procedure, Other",Parallel Assignment,Not Applicable,No,No,156
IB 2019-01,Atezolizumab Combined With BDB001 AnD Immunogenic Radiotherapy in Patients With Advanced Solid Tumors,1431 days,Recruiting,Interventional,"Experimental, Experimental, Experimental, Experimental, Experimental, Experimental","Drug, Drug, Drug, Drug, Drug, Drug",Parallel Assignment,Phase 2,No,No,247
2022-010,F-Tryptophan PET/CT in Human Cancers,824 days,Recruiting,Interventional,Experimental,Drug,Single Group Assignment,Phase 1,Yes,No,24
Reader-02 Study,Optoacoustic Images Versus Imagio® Ultrasound,96 days,Completed,Interventional,"Active Comparator, Experimental","Device, Device, Device",Sequential Assignment,Not Applicable,No,Yes,480
20-03,"A Prospective, Multi-site Clinical Study to Collect User Feedback Using Affirm® Contrast Biopsy",531 days,Completed,Interventional,Other,Device,Single Group Assignment,Not Applicable,No,Yes,60
YWBC-002,Prevention and Treatment of Pyrrolitinib-associated Diarrhea,1079 days,Recruiting,Interventional,"Experimental, Experimental, Experimental, No Intervention","Drug, Drug, Drug",Parallel Assignment,"Phase 2, Phase 3",No,No,470
2019-1176,Patient-Specific Decision Aid System for Shared Decision Making About Breast Reconstruction,809 days,Recruiting,Interventional,"Experimental, Active Comparator","Other, Other, Procedure, Other, Other",Parallel Assignment,Not Applicable,No,No,40
2018-4107,Does a Preoperative Prophylactic Antibiotic Reduce Surgical Site Infection Following Wire-localized Lumpectomy,612 days,Completed,Interventional,"Experimental, No Intervention",Drug,Parallel Assignment,Not Applicable,No,No,326
2021-0290,Effect of Neurotization on QoL and Sensory Restoration,275 days,Not yet recruiting,Interventional,"Experimental, No Intervention",Procedure,Parallel Assignment,Phase 2,No,No,50
0180910/16,The Combination of PECS II Block and Parasternal Block for Radical Mastectomy,132 days,Completed,Interventional,Experimental,"Procedure, Drug",Single Group Assignment,Not Applicable,No,No,65
INTRUSION,INTRUSION: Unraveling the INTRatUmoral PK/PD relatION for SAR408701,820 days,Not yet recruiting,Interventional,Experimental,Drug,Single Group Assignment,Phase 2,No,No,60
R.22.09.1830,Comparison of Analgesic Efficacy of Ultrasound Guided Rhomboid Intercostal Block Versus Serratus Anterior Plane Block for Mastectomy Surgery,120 days,Recruiting,Interventional,"Active Comparator, Active Comparator","Other, Other",Parallel Assignment,"Phase 2, Phase 3",No,No,60
SCOUT2021,Streamlined Localization Using SCOUT® at Biopsy (STREAMLoc ),700 days,Recruiting,Interventional,Experimental,Device,Single Group Assignment,Not Applicable,No,No,500
PROICM 2019-07 PRE,Predictive Toxicity Test Linked to Radiotherapy After Mastectomy and Immediate Implant Reconstruction,2363 days,Recruiting,Interventional,Experimental,Device,Single Group Assignment,Not Applicable,No,No,250
2022-A01940-43,Randomized Study Versus Placebo for the Prevention of Neurotoxicity Induced by Weekly PACLITAXEL,549 days,Not yet recruiting,Interventional,"Placebo Comparator, Experimental","Drug, Other",Parallel Assignment,Phase 2,No,No,60
Reader-01,"Imagio Feasibility Multi-Reader, Multi-Case Study",26 days,Completed,Interventional,"Active Comparator, Experimental","Device, Device, Device",Sequential Assignment,Not Applicable,No,Yes,155
STUDY00025461,Use of Virtual Reality Goggles During Chemotherapy Infusion to Reduce Anxiety-Related Symptoms,67 days,Not yet recruiting,Interventional,"Experimental, Active Comparator","Other, Behavioral, Other",Parallel Assignment,Not Applicable,No,No,44
19D.203,Contrast Enhanced Mammography in Diagnosing Patients With Suspicious Breast Findings,948 days,Completed,Interventional,Experimental,Procedure,Single Group Assignment,Not Applicable,No,No,107
BCD-178-1,"A Double-Blind, Comparative, Randomized Clinical Study of the Pharmacokinetics, Safety, and Immunogenicity of a Single Intravenous Infusion of BCD-178 or Perjeta® in Healthy Volunteers",541 days,"Active, not recruiting",Interventional,"Experimental, Active Comparator","Drug, Drug",Parallel Assignment,Phase 1,No,No,100
SHR6390-I-114,Study of SHR6390 in Renal Insufficiency and Healthy Subjects,284 days,Recruiting,Interventional,"Experimental, Experimental, Experimental",Drug,Parallel Assignment,Phase 1,No,No,30
2204MDJ,Testing Video Information About Mammography Screening,44 days,Unknown status,Interventional,"Experimental, Placebo Comparator","Other, Other",Parallel Assignment,Not Applicable,No,No,400
mastectomy regional anesthesia,Regional Anesthesia for Modified Radical Mastectomy With Axillary Lymph Node Dissection,1035 days,Completed,Interventional,Experimental,Other,Single Group Assignment,Phase 3,No,No,13
PECS 2019,The Analgesic Efficacy of the Pectoral Nerves Block Versus Local Anesthetic Infiltration After Mastectomy,607 days,Unknown status,Interventional,"Active Comparator, Active Comparator","Other, Other",Parallel Assignment,Phase 4,No,No,50
R-2017/UEM11,Acute Effect of Chromatic Environment During Chemotherapy,975 days,Unknown status,Interventional,"Experimental, Experimental, Experimental, Experimental","Other, Other",Crossover Assignment,Not Applicable,No,No,20
IBIO-302,Food Effect Study of D-0502 Tablet in Healthy Volunteers,176 days,Completed,Interventional,"Experimental, Experimental",Drug,Crossover Assignment,Phase 1,Yes,No,14
LAE203CN2101,PhI to Solid Tumors and PhII to Locally Advanced or mTNBC,1144 days,Recruiting,Interventional,"Active Comparator, Active Comparator, Active Comparator, Placebo Comparator","Combination Product, Combination Product, Combination Product, Drug",Sequential Assignment,"Phase 1, Phase 2",No,No,101
SN132D CSP final version 6.0,A First-in-human Clinical Evaluation of SN132D in Patients With Breast and Pancreatic Cancer,1195 days,Completed,Interventional,Experimental,Drug,Single Group Assignment,Phase 1,No,No,14
2022-1151,Implementation of Population Breast Cancer Genetic Services in Federally Qualified Health Centers (FQHC),1583 days,Not yet recruiting,Interventional,"Experimental, Active Comparator","Other, Other",Parallel Assignment,Not Applicable,No,No,130
NINTAU,ConquerFear-Group: A Psychological Intervention for Fear of Cancer Recurrence,975 days,Completed,Interventional,"Experimental, Placebo Comparator","Behavioral, Behavioral",Parallel Assignment,Not Applicable,No,No,85
21-002713,3D Ultrasound Microvessel Imaging for Breast Masses,975 days,Recruiting,Interventional,Experimental,"Other, Procedure",Single Group Assignment,Early Phase 1,No,Yes,50
LIVFOU-930411,Pectoral Nerves Block vs Wound Infiltration for Partial Mastectomy - a Prospective Randomized Trial.,436 days,Completed,Interventional,"Active Comparator, Active Comparator","Procedure, Procedure, Procedure, Drug, Device",Parallel Assignment,Not Applicable,No,No,60
21-BI-1607-01,BI-1607 in Combination With Trastuzumab in Subjects With HER2-positive Advanced Solid Tumors,1587 days,Recruiting,Interventional,"Experimental, Experimental","Drug, Drug, Drug",Sequential Assignment,"Phase 1, Phase 2",No,No,116
20-378,Researching the Effect of Exercise on Cancer,1461 days,Recruiting,Interventional,"Experimental, Experimental",Other,Sequential Assignment,Not Applicable,No,No,70
2019-A0872-55,Study on Skin Toxicities Induced by Cancer Treatments,1338 days,Recruiting,Interventional,Experimental,Other,Single Group Assignment,Not Applicable,No,No,300
CAAA504A12101,Study of [68Ga]-FF58 in Patients With Selected Solid Tumors Expected to Overexpress αvβ3 and αvβ5 Integrins.,757 days,Recruiting,Interventional,"Experimental, Experimental, Experimental, Experimental",Drug,Parallel Assignment,Early Phase 1,Yes,No,80
D6900C00001,First in Human Study to Evaluate AZD8205 in Patients With Advanced or Metastatic Solid Malignancies,1351 days,Recruiting,Interventional,Experimental,Drug,Sequential Assignment,"Phase 1, Phase 2",Yes,No,198
HNCH-BC004,A Study of Monosialic Gangliosides to Prevent Albumin-bound Paclitaxel Neurotoxicity,601 days,Completed,Interventional,"Experimental, Placebo Comparator","Drug, Other",Parallel Assignment,Phase 2,No,No,159
20200491,Application of Chinese Herbal Complementary and Alternative Medicine (CAM) to Improve Human Health and to Further Botanical and Horticultural Sciences,1279 days,Recruiting,Interventional,Experimental,Other,Single Group Assignment,Not Applicable,No,No,40
PRO2021-1428,Efficacy and Safety of TILs in Treatment of Patients With Advanced or Metastatic Refractory Gynecological Cancer,1825 days,Not yet recruiting,Interventional,Experimental,Biological,Single Group Assignment,"Phase 1, Phase 2",No,No,91
ZN-A-1041-101,Trial of ZN-A-1041 Enteric Capsules in Patients With HER2-Positive Advanced Solid Tumors,1354 days,Recruiting,Interventional,"Experimental, Experimental, Experimental, Experimental, Experimental, Experimental, Experimental, Experimental, Experimental, Experimental, Experimental","Drug, Drug, Drug, Drug, Drug, Drug, Drug, Drug, Drug, Drug, Drug",Sequential Assignment,Phase 1,No,No,84
HCC 21-265,"Dignity, Legacy, Advocacy, and Support for Advanced Cancer: Reimagined End of Life Care in the Black Community",1176 days,Recruiting,Interventional,Experimental,Behavioral,Single Group Assignment,Not Applicable,No,No,5
HNCH-BC007,GM1 in the Treatment of Neurotoxicity Induced by Albumin-bound Paclitaxel,712 days,Withdrawn,Interventional,"Experimental, Placebo Comparator","Drug, Other",Parallel Assignment,Phase 2,No,No,0
2020-0498,Myofascial Release or Trigger Point Injections for the Reduction of Post-Mastectomy Pain Syndrome,0 days,Withdrawn,Interventional,"Active Comparator, Experimental","Procedure, Procedure, Other, Other",Parallel Assignment,Not Applicable,No,Yes,0
NBE-002-01,NBE-002 in Patients With Advanced Solid Tumors,1991 days,"Active, not recruiting",Interventional,"Experimental, Experimental, Experimental, Experimental",Drug,Sequential Assignment,"Phase 1, Phase 2",Yes,No,100
1B-22-2,"In Situ Immunomodulation With CDX-301, Radiation Therapy, CDX-1140 and Poly-ICLC in Patients w/ Unresectable and Metastatic Solid Tumors",1096 days,Recruiting,Interventional,"Experimental, Experimental","Biological, Drug, Radiation, Biological",Sequential Assignment,Phase 1,Yes,No,18
PROT002 - Test Plan 01 Rev A,Blue Note Therapeutics Product BNT 103 Usability and User Engagement,121 days,Completed,Interventional,Experimental,Device,Single Group Assignment,Not Applicable,No,Yes,15
Gen 2 - 01,Clinical Evaluation of Opto-Acoustic Image Quality With the Gen 2 Imagio System,182 days,Completed,Interventional,Experimental,Device,Single Group Assignment,Not Applicable,No,Yes,38
PROT001,Registrational Trial to Compare Effectiveness of Two Digital Software Medical Devices as Adjunctive Oncology Treatment,474 days,Terminated,Interventional,"Active Comparator, Active Comparator","Device, Device",Parallel Assignment,Not Applicable,No,No,31
MW05-2020-CP301,Trial to Compare the Efficacy and Safety Of MW05 and PEG-rhG-CSF,775 days,Completed,Interventional,"Experimental, Experimental, Active Comparator","Drug, Drug",Parallel Assignment,"Phase 2, Phase 3",No,No,586
BYON5667.002,Evaluation of Safety and Efficacy of Sodium Thiosulfate (BYON5667) Eye Drops to Reduce Ocular Toxicity in Cancer Patients Treated With SYD985,1086 days,"Active, not recruiting",Interventional,"Experimental, Placebo Comparator","Drug, Drug",Parallel Assignment,"Phase 1, Phase 2",No,No,48
UZBRU_VHH2_1,Phase I/IIa Study of 68GaNOTA-Anti-MMR-VHH2 for PET/CT,1243 days,Recruiting,Interventional,"Experimental, Experimental",Drug,Sequential Assignment,"Phase 1, Phase 2",No,No,37
19-007547,"Autophagy Activation for the Alleviation of Cardiomyopathy Symptoms After Anthracycline Treatment, ATACAR Trial",1582 days,Recruiting,Interventional,"Active Comparator, Experimental","Drug, Drug, Drug, Drug",Parallel Assignment,Phase 2,Yes,No,40
Pro00092817,VR Ultrasound Guided Breast Localization,359 days,Completed,Interventional,"Experimental, No Intervention",Device,Parallel Assignment,Not Applicable,No,No,60
Pro00112215,The Use of Virtual Reality During Breast Ultrasound-Guided Biopsy Procedures,381 days,Enrolling by invitation,Interventional,"Experimental, No Intervention",Device,Parallel Assignment,Not Applicable,No,No,60
5R44CA203608,LymphBridge: Surgical Evaluation for Breast Cancer-Associated Lymphedema (BioBridge),1207 days,Recruiting,Interventional,"Experimental, Active Comparator","Device, Procedure",Parallel Assignment,Not Applicable,No,Yes,60
M16-573,A Study With ABBV-155 Alone and in Combination With Taxane Therapy in Adults With Relapsed and/or Refractory Solid Tumors,1752 days,"Active, not recruiting",Interventional,"Experimental, Experimental, Experimental, Experimental, Experimental","Drug, Drug, Drug",Sequential Assignment,Phase 1,Yes,No,169
ACROPOLI (SOLTI-1904),Efficacy of Spartalizumab Across Multiple Cancer-types in Patients With PD1-high mRNA Expressing Tumors,1339 days,"Active, not recruiting",Interventional,Experimental,Drug,Single Group Assignment,Phase 2,No,No,73
NL52329.075.15,Intra-individual Comparison of Conventional and Digital PET/CT Scanners,613 days,Completed,Interventional,Other,Diagnostic Test,Single Group Assignment,Not Applicable,No,No,225
AAAT2490,AVI Didactic Experience for Latinx Patient Treatment Adherence and Non-English Speaker Trial Enrollment Study in Rad Onc,1673 days,Recruiting,Interventional,"Experimental, Active Comparator, Experimental, Active Comparator","Other, Other, Other, Other",Factorial Assignment,Not Applicable,No,No,240
CMP-001-009,A Trial to Find Out if Vidutolimod Together With Cemiplimab is Safe and if it Works in Adult Participants With Advanced Cancer or Metastatic Cancer,1923 days,Recruiting,Interventional,"Experimental, Experimental, Experimental, Experimental, Experimental, Experimental, Experimental, Experimental","Drug, Drug",Parallel Assignment,Phase 2,Yes,No,200
SS-SP01-201904,Granisetron Transdermal Patch for Prophylaxis of Nausea and Vomiting in Patients Receiving Oral Anticancer Agents,896 days,Recruiting,Interventional,Experimental,Drug,Single Group Assignment,Phase 2,No,No,60
5890-001,Study of Boserolimab (MK-5890) as Monotherapy and in Combination With Pembrolizumab (MK-3475) in Adults With Advanced Solid Tumors (MK-5890-001),2441 days,"Active, not recruiting",Interventional,"Experimental, Experimental, Experimental, Experimental","Drug, Biological, Drug, Drug, Drug",Parallel Assignment,Phase 1,Yes,No,202
H19-03343,Carbon-Fibre Accessory (CARA) for Supine Breast Positioning to Reduce Toxicity in Whole Breast Radiotherapy,1664 days,Recruiting,Interventional,"Experimental, No Intervention",Device,Parallel Assignment,Not Applicable,No,No,220
BPI-2358-106 phase 3,Plinabulin vs. Pegfilgrastim in Prevention of TAC Induced Neutropenia,2164 days,"Active, not recruiting",Interventional,"Active Comparator, Experimental","Drug, Drug, Other, Drug",Parallel Assignment,Phase 3,Yes,No,221
EK 1623/2020,Dose-staged Gamma Knife Radiosurgery Versus Microsurgical Resection,1248 days,Recruiting,Interventional,"Other, Other","Procedure, Procedure",Parallel Assignment,Not Applicable,No,No,100
TRX518-004,A Dose Escalation and Expansion Study of TRX518 in Combination With Cyclophosphamide Plus Avelumab in Advanced Solid Tumors,421 days,Terminated,Interventional,"Experimental, Experimental, Experimental, Experimental, Experimental","Drug, Drug, Drug",Parallel Assignment,"Phase 1, Phase 2",Yes,No,10
20200110,Study of the Effects of Transcutaneous Vagus Nerve Stimulation on Cancer Patients,636 days,Recruiting,Interventional,"Sham Comparator, Active Comparator",Device,Parallel Assignment,Not Applicable,No,No,130
ASPB vs ESBP for mastectomy,Comparison Between Serratus Anterior Plane Block and Erector Spinae Plane Block for Mastectomy,303 days,Completed,Interventional,"Active Comparator, Active Comparator",Procedure,Parallel Assignment,Not Applicable,No,No,25
2018-01,Quantitative Evaluation of the Breasts Morphological Variations During Radiotherapy: MorphoBreast3D,805 days,Completed,Interventional,Experimental,Device,Single Group Assignment,Not Applicable,No,No,60
TYKM1602101,A Study of TY-302 in Patients With Advanced Solid Tumors,1089 days,Recruiting,Interventional,Experimental,Drug,Single Group Assignment,Phase 1,No,No,60
BrUOG 351,BrUOG 351: PRE-OPERATIVE APBI USING NIBB,326 days,Withdrawn,Interventional,Experimental,"Radiation, Procedure",Single Group Assignment,Not Applicable,No,No,0
